{
  "$schema": "https://json-schema.org/draft/2020-12/schema",
  "$id": "doppelganger.marketplace.hdda-registry-dependency.v1",
  "title": "Marketplace dependency on the HDDA Capabilities host and gateway registry",
  "type": "object",
  "additionalProperties": false,
  "required": ["version", "authority", "host", "api", "unitMutation", "auth"],
  "properties": {
    "version": {
      "const": "doppelganger.marketplace.hdda-registry-dependency.v1"
    },
    "authority": { "const": "doppelganger-registry" },
    "host": {
      "type": "object",
      "additionalProperties": false,
      "required": [
        "entry",
        "tabs",
        "projection",
        "kernelContributions",
        "lifecycleOwnership"
      ],
      "properties": {
        "entry": { "const": "Capabilities" },
        "tabs": { "const": ["Skills", "Plugins", "Extensions"] },
        "projection": {
          "const": {
            "registryUnitField": "capabilityProjection",
            "gatewayPluginId": "doppelganger-registry",
            "recordsPath": "/api/plugins/doppelganger-registry/proxy/marketplace/api/plugins/marketplace-hub/records",
            "recordSchema": "doppelganger.marketplace.capabilities-host.v1",
            "authenticated": true,
            "hostOwnsRendering": true,
            "hostOwnsTabs": true,
            "modalOwnership": "host-generic",
            "duplicateOwnership": "fail-closed",
            "tabReplacement": "forbidden"
          }
        },
        "kernelContributions": {
          "const": {
            "records": {
              "type": "capability-record",
              "region": "app.capabilities.records"
            },
            "settings": {
              "type": "capability-settings-surface",
              "region": "app.capabilities.settings",
              "schemaVersion": "doppelganger.capability-settings.v1"
            }
          }
        },
        "lifecycleOwnership": {
          "const": {
            "canonical": "marketplace",
            "directHermesRole": "underlying-adapters-only",
            "normalModeDirectHermesControls": false,
            "duplicateLifecycleControls": "forbidden"
          }
        }
      }
    },
    "api": {
      "type": "object",
      "additionalProperties": false,
      "required": [
        "snapshot",
        "currentWholeDocumentWrite",
        "candidateUnitEnablement",
        "capabilitiesProjection"
      ],
      "properties": {
        "snapshot": {
          "const": {
            "method": "GET",
            "path": "/api/plugins/doppelganger-registry/snapshot"
          }
        },
        "currentWholeDocumentWrite": {
          "const": {
            "method": "PUT",
            "path": "/api/plugins/doppelganger-registry/registry",
            "marketplaceMayCall": false
          }
        },
        "candidateUnitEnablement": {
          "const": {
            "owner": "hdda-primary-desktop-lane",
            "method": "PUT",
            "pathTemplate": "/api/plugins/doppelganger-registry/units/{unit_id}/enabled",
            "request": { "enabled": "boolean" },
            "success": {
              "ok": "boolean",
              "unit": "RegistryUnit",
              "snapshot": "RegistrySnapshot"
            },
            "errors": {
              "400": "invalid request JSON or enabled is not boolean",
              "404": "unknown unit",
              "409": "required unit, malformed registry, or unavailable registry conflict",
              "500": "atomic registry update failed"
            },
            "semantics": [
              "lock-protected",
              "atomic-write",
              "preserves-unrelated-raw-registry-fields-and-units"
            ],
            "status": "pending-hdda-pr-8"
          }
        },
        "capabilitiesProjection": {
          "const": {
            "method": "GET",
            "pathFromRegistryUnit": "capabilityProjection.recordsPath",
            "gatewayPluginIdFromRegistryUnit": "capabilityProjection.gatewayPluginId",
            "authenticated": true,
            "schema": "doppelganger.marketplace.capabilities-host.v1"
          }
        }
      }
    },
    "unitMutation": {
      "type": "object",
      "additionalProperties": false,
      "required": [
        "owner",
        "marketplaceWritesRegistry",
        "requiredPolicy",
        "hubEnablementOperations"
      ],
      "properties": {
        "owner": { "const": "hdda-primary-desktop-lane" },
        "marketplaceWritesRegistry": { "const": false },
        "requiredPolicy": {
          "const": "required-units-cannot-disable-or-uninstall"
        },
        "hubEnablementOperations": { "const": ["enable-unit", "disable-unit"] }
      }
    },
    "auth": {
      "type": "object",
      "additionalProperties": false,
      "required": ["owner", "externalAuthScope", "status"],
      "properties": {
        "owner": { "const": "hdda-host-sdk" },
        "externalAuthScope": { "const": "auth" },
        "status": { "const": "permissioned-hdda-dependency" }
      }
    }
  }
}
